video_id,comment,comment_date
xJlgtV8L7Jc,For more on this: https://sc.mp/gjys,2023-07-26T04:11:40Z
xJlgtV8L7Jc,"Yes,  punish the criminals , not the innocent people",2023-08-03T03:52:04Z
xJlgtV8L7Jc,"Flor Contemplacion had been there. Filipinos know it, and a movie had been made out of her experience.",2023-08-02T15:10:36Z
xJlgtV8L7Jc,Bravo Singapore.,2023-08-01T17:07:10Z
xJlgtV8L7Jc,Don't mind these westoids. I'm half Indonesian-Malaysian and I applaud Singapore's effort for combating drug trafficking,2023-08-01T08:46:42Z
